ROW_ID,ROW_VERSION,studyName,studyId,studyFileviewId,studyStatus,dataStatus,studyLeads,fundingAgency,summary,summarySource,institutions,diseaseFocus,manifestation,featured,consortium,id,accessRequirements,acknowledgementStatements,relatedStudies
205,99,Exploring Nonsense Suppression as a Treatment for NF1,syn21641813,syn21666953,Active,None,David Bedwell,GFF,"Nonsense mutations comprise around 20% of NF1 mutations. Nonsense mutations are gene lesions that introduce a premature termination codon (PTC) into a messenger RNA (mRNA). A PTC reduces protein expression through two mechanisms. First, a PTC prematurely terminates translation of an mRNA, which prevents the formation of a full-length, functional protein. Second, a PTC can trigger the nonsense-mediated mRNA decay (NMD) pathway, which degrades the mRNA and prevents it from undergoing translation. Together, these two PTC-mediated mechanisms can severely reduce neurofibromin protein expression and function. Since PTCs are found in a significant number of NF1 patients, we propose to identify therapies that suppress the effects of PTCs to restore neurofibromin protein expression and function. Work previously funded by the Cystic Fibrosis Foundation (CFF) developed and characterized reporters that can detect compounds capable of suppressing termination at PTCs and/or inhibiting nonsense-mediated mRNA decay (NMD) of PTC-containing mRNAs. A total of 771,345 small molecules were screened and 157 compounds were confirmed as hits. The project proposed here would examine whether this collection of new, validated, PTC suppression agents restore full-length neurofibromin protein and its function in NF1 cell and animal models that carry nonsense mutations. The goal of this study is to identify multiple compounds for advancement to Investigational New Drug (IND) status in preparation for future clinical trials.",https://www.synapse.org/#!Synapse:syn21641813/wiki/601388,"University of Alabama, Birmingham",Neurofibromatosis 1,,,,,Accessing the data from this study requires a Synapse account. You must also [request access](https://www.synapse.org/#!Synapse:syn7231973/wiki/588793) from the study investigators.,,"syn21641876, syn21642027"
206,99,Genome Editing with Engineered Vectors to Correct Neurofibromatosis Type I,syn21641872,syn21667850,Active,None,Charles Gersbach,GFF,"Neurofibromatosis type I (NF1) is caused by mutations to the NF1 gene that lead to the development of tumors of the peripheral nervous system. Gene therapy has seen tremendous advances in recent years in the delivery of genes to select tissues to compensate for mutations that cause genetic disease. However, there are two primary challenges that prevent extending these developments to NF1. First, there is currently no method to deliver genes to the cells that initiate tumor development. Second, the NF1 gene is particularly large and is not accommodated within the size-restricted viruses currently used for gene therapy. A team was assembled with the unique and complementary expertise to overcome both of these challenges and apply the resulting technology to clinically relevant animal models of NF1. First, an innovative strategy will be used to engineer new viruses that target the tumor initiating cells of the peripheral nervous system. Second, CRISPR-based genome editing will be used to restore the mutated NF1 gene, thereby circumventing the need to deliver a copy of the full-length NF1 gene sequence. Finally, the ability of these engineered viruses and genome editing strategies to reduce tumor burden in a mouse model of NF1 will be tested. Each of these approaches have been successfully applied in the context of other disease areas, and through this project this success will be extended to address the challenges of developing a gene therapy for NF1. This work will also involve several technological advances that will be generally useful to the field and complement other strategies being explored to apply gene therapy and genome editing to NF1. The team is further complemented by direct clinical experience with NF1 patients. This project applies some of the most exciting modern biotechnologies to a particularly challenging disease that will be certain to catalyze new innovations for treating NF1.",https://www.synapse.org/#!Synapse:syn21641872/wiki/601390,Duke University,Neurofibromatosis 1,,,,,,,"syn21641931, syn21641945, syn21641955, syn21642010"
207,99,Ataluren-promoted therapeutic nonsense suppression for neurofibromatosis,syn21641876,syn21668311,Active,None,Allan Jacobson,GFF,"Nonsense codons are words in the genetic code that instruct the gene expression apparatus to stop the process of protein synthesis at a precise point, i.e., they delineate the boundary of the information in a gene that encodes a specific protein. Although nonsense codons are normally an integral part of the flow of information from DNA to RNA to protein, they also arise in random places within genes because of a specific type of mutation known as a nonsense mutation. Such mutations halt the process of protein synthesis prematurely and thus inactivate the function of genes and cause genetic disorders. Nonsense mutations comprise ~20% of the disease-causing mutations in neurofibromatosis type 1 (NF1). The drug, ataluren, can suppress protein synthesis termination at premature nonsense codons and produce limited but functionally significant quantities of essential proteins in patients with Duchenne muscular dystrophy (DMD) and in mouse and tissue culture models of multiple diseases. In the experiments of this proposal mouse cells will be grown and live mice whose NF1 genes harbor nonsense mutations and test whether ataluren can restore the synthesis and function of the NF1 protein in these cells and animals. Success with these experiments will lead to the initiation of phase 2 proof-of-concept clinical trials with neurofibromatosis patients whose disease is caused by nonsense mutations.",https://www.synapse.org/#!Synapse:syn21641876/wiki/601392,University of Massachusetts,Neurofibromatosis 1,,,,,,,"syn21641813, syn21642027"
208,99,NF1 Gene Rescue in Translational Animal Models,syn21641931,syn21668501,Active,None,Robert Kesterson,GFF,"The goal of this project is to test new technologies for correcting NF1 mutations at the genome or DNA level instead of current efforts that are focused largely on regulating targets in the NF1 signaling pathway. The proposal establishes a new collaborative team that brings together the expertise of two laboratories, each of which has established critical technologies and reagents on hand that provides a new approach for treating NF1. The Kesterson lab (UAB) has established several critical reagents for the study of NF1 including a newly created system to study NF1 by having a full-length NF1 cDNA that represents the key ""coding"" regions of the NF1 gene, which has all the critical information needed to produce the entire neurofibromin protein. His laboratory has also created the first mice and rats that have mutations in their NF1 gene that completely mimic those seen in patients. The Zhou lab (Yale) has developed key technologies based on ""nanoparticles"" for delivery of large size DNA like NF1, or for gene-editing reagents known as CRISPR/Cas9 that can correct mutations at the DNA level. This project proposes to conduct needed pre-clinical studies in NF1 relevant animal models to assess the ability to use nanoparticles to 1) deliver the cDNA that will then make neurofibromin protein, and 2) deliver the gene-editing reagents to directly correct the mutation causing NF1. Rats will also be created that carry NF1 patient mutations and characterize those for tumor formation and cognitive deficits. Rats are well known in the neuroscience field as the preferred species to assess cognitive and behavioral function. The ability of the nanoparticles to treat anticipated cognitive and behavioral deficits in the rats with NF1 mutations will be tested as well. If successful, the new systems will provide essential pre-clinical data and lay the foundation for clinical trials using nanomedicine to treat NF1 disease.",https://www.synapse.org/#!Synapse:syn21641931/wiki/601396,"University of Alabama, Birmingham",Neurofibromatosis 1,,,,,,,"syn21641872, syn21641945, syn21641955, syn21642010"
209,99,NF1 RNA Repair Based on Therapeutic Ribozymes,syn21641945,syn21669328,Active,None,Andre Leier | Ulrich Muller,GFF,"The 1989 Nobel Prize in Chemistry went to Thomas R. Cech and Sydney Altman for their discovery of ribonucleic acid (RNA) molecules with catalytic properties similar to those of protein enzymes, leading to the term 'ribozymes'. Cech and colleagues studied a specific ribozyme, an intron of a gene in Tetrahymena thermophila, a single-celled organism. Ribozymes of its kind can be modified to specifically bind to a target RNA of choice, split this RNA at a specific site into two parts, and replace one part with another RNA sequence that is attached to the ribozyme. This so-called trans-splicing ability of engineered ribozymes establishes a potential strategy for therapeutic RNA repair: The faulty part of RNA that resulted from a genetic mutation in its associated gene is removed and replaced by the correct part. Such a repaired transcript then translates into fully functional proteins. Early proofs of this concept demonstrated repair of defective RNAs involved in cancer (p53), myotonic muscular dystrophy (DMPK) and sickle-cell anemia (beta-globin). This proposal builds upon this concept: Bioengineered trans-acting ribozymes are used to target faulty transcripts of the NF1 gene that carry mutations causing neurofibromatosis type 1 (NF1). The aim is to effectively and specifically restore function to the NF1 gene product for a variety of patient-derived NF1 mutations in human cell lines. As part of the ribozyme design, potential obstacles on the path to NF1 clinical application will be considered and analyzed, including delivery of the therapeutic ribozymes, avoidance of off-target effects, and minimization of a possible immune response. By developing NF1 mouse models with patient specific mutations that are amenable to ribozyme-mediated correction we will prepare for subsequent animal studies, a necessary step prior to clinical testing. We envision our research to constitute the first step towards a novel RNA-based therapy for the treatment of NF1.",https://www.synapse.org/#!Synapse:syn21641945/wiki/601398,"University of Alabama, Birmingham | University of California, San Diego",Neurofibromatosis 1,,,,,,,"syn21641872, syn21641931, syn21641955, syn21642010"
210,99,Investigating Synthetic Lethality Associated with NF1 Loss,syn21641955,syn21669353,Active,None,Eric Pasmant | Raphael Margueron,GFF,"Neurofibromatosis type 1 (NF1) is a genetic disease caused by a mutation of NF1, a gene which normally limits cell proliferation. NF1 patients initially have one of the two NF1 alleles which remains normal but is prone to become inactivated. When this occurs, benign tumors called neurofibromas develop and cause various health complications. In some cases, neurofibromas transform into aggressive life-threatening tumors. Initial identification of the NF1 gene as causative for the disease created hope that the defect could be corrected using gene therapy strategies. However, genetic correction of NF1 mutations is met with several outstanding issues that render this type of approach unlikely to succeed for the time being. Instead of trying to correct the disease causing-mutation, this project proposes a new approach to treat NF1 that aims at killing cells that have inactivated both copies of the NF1 gene. The concept underlying this original therapeutic approach is based on the fact that mutation of one gene often creates vulnerabilities towards inactivation of other genes that are not normally required for cell survival. A spinoff of the recently developed CRISPR/CAS9 technology will be used to identify genes that become essential for the survival of cells that have inactivated both copies of the NF1 gene. The focus will then move to target genes for which an FDA-approved drug is already available. Such a drug, if successful in killing NF1-mutant cells, should quickly become available for clinical testing in NF1 patients.",https://www.synapse.org/#!Synapse:syn21641955/wiki/601400,University Paris Descartes | Institut Curie,Neurofibromatosis 1,,,,,,,"syn21641872, syn21641931, syn21641945, syn21642010"
211,99,Development of Mutation Suppression Therapy in a Swine Model of NF1,syn21642027,syn21669564,Active,None,Adrienne Watson | David Largaespada,GFF,"One in five Neurofibromatosis Type 1 (NF1) patients have a specific type of mutation in the NF1 gene that causes its protein production machinery to stop early, resulting in a shortened and usually non-functional product. There is a type of drug called a ""nonsense mutation suppressor"" that restores full-length production of protein in genes that have these mutations. These drugs are being developed for diseases like Cystic Fibrosis and Duchenne Muscular Dystrophy, and many clinical trials are underway for these patients. Unfortunately, the immense impact these drugs could have on NF1 patients with these mutations has yet to be explored. The goal of this proposal is to investigate the potential of nonsense mutation suppression therapies in NF1 patients. This group has developed a minipig model of NF1 that shows many of the clinical signs seen in human patients of NF1, including cafe-au-lait spots, dermal neurofibromas, and optic pathway glioma, and it has been used to find drugs that are both safe and effective in our preclinical model that can better inform researchers and clinicians before these drugs go into clinical trials in NF1 patients. Here, this project aims to develop a new swine model of NF1 with a slightly different mutation that will be suitable for testing these nonsense mutation suppression therapies. The preclinical utility of these drugs will be established with the goal of initiating a clinical trial in NF1 patients with a drug that is safe, tolerable, and effective in restoring NF1 gene function. The NF1 pig model developed in this proposal is expected to develop tumors similar to those found in human patients and can be used to establish the ability of these novel therapies to both eradicate the underlying genetic abnormality and cure existing manifestations of the condition in people living with NF1.",https://www.synapse.org/#!Synapse:syn21642027/wiki/601406,Recombinetics | University of Minnesota,Neurofibromatosis 1,,,,,,,"syn21641813, syn21641876"
212,99,Exon skipping to treat Neurofibromatosis Type 1 (NF1) mutations,syn21642010,syn21669676,Active,None,Deeann Wallis | Linda Popplewell,GFF,"Most currently available drugs to treat Neurofibromatosis Type I (NF1) are targeted at tumors; and as with many chemotherapies, they tend to have toxic side effects. Newer, less toxic therapies are needed. Antisense directed gene therapy, and more specifically exon skipping, is a successful therapeutic strategy for other diseases including Duchenne muscular dystrophy (DMD) which also affects children. Antisense directed gene therapy causes cells to ""skip"" over faulty pieces of the genetic code, leading to a truncated but still functional protein despite the genetic mutation. Antisense oligonucleotides (AONs) are short synthetic modified nucleic acids that bind RNA through base pairing and enable modulation of its expression. The project hypothesizes that antisense directed gene therapy can be utilized to treat NF1 and is designed to test that possibility. Exons, the coding part of genes, within the NF1 transcript that may be skipped and still maintain gene function must be identified. The first aim is to create copies of the NF1 gene that are missing these prioritized exons and test their function in cell-based molecular assays. Next, antisense oligonucleotides will be designed and tested. This will involve computer-aided sequence analysis of the NF1 genomic region and the design of NF1 antisense phosphonodiamidite morpholino oligomers (PMOs) that target specific exons. These PMOs will be tested in normal cells for their exon-skipping efficiency. Human cell lines that have deleterious, patient-specific NF1 mutations will also be created using CRISPR/Cas9 technology to edit the genome. These mutations will occur within exons that have been shown to maintain gene function after deletion. PMOs that are efficacious will be moved forward and be tested in dose response for exon skipping efficiency in cells containing patient mutations. NF1 function will also be evaluated. Finally, mice models will be created, and the phenotypes characterized such that they may be used to show proof-of-Principal that exon skipping could be therapeutic for NF1. Ideally, exon skipping could be used clinically to treat NF1 patients that harbor mutations in non-critical regions of the gene. Production of even partially functional NF1 could help ameliorate phenotypes. This project will make the following three contributions to advancing the field of NF research. First, we will determine if exon skipping strategies are even a possibility for treating NF1. Second, data generated will direct future structure-function studies and possibly help lead to a ""mini-NF1"" gene cassette for gene replacement therapies. Finally, generation of mutant human cell lines and mice provides a resource for many other projects.",https://www.synapse.org/#!Synapse:syn21642010/wiki/601404,"University of Alabama, Birmingham | Royal Holloway University of London",Neurofibromatosis 1,,,,,,,"syn21641872, syn21641931, syn21641945, syn21641955"
213,99,"AAV, Zinc Finger Protein and Antisense Oligonucleotide Strategies for Restoration of Neurofibromin Expression",syn21641985,syn21669822,Active,None,Miguel Sena-Esteves | Scott Wolfe | Matthew Gounis | Jonathan Watts | Xandra Breakefield | Casey Maguire,GFF,"Neurofibromatosis type I (NF1) is a genetic disorder caused by mutations in the neurofibromin gene. Patients with NF1 suffer from a variety of health challenges, including skin lesions, benign and malignant tumors of the optic and peripheral nervous system, and cognitive deficits. Current treatment options are limited and do not address the primary genetic defect associated with this disorder, namely the reduction in levels or complete loss of the neurofibromin protein within affected tissues. This project seeks to develop therapeutics that will directly address this core deficit in NF1 patients. The central focus is to develop two new NF1 drug candidates that will be ready for Pre-IND discussions with the FDA at the end of the third year of study. This ambitious goal will be achieved by developing and characterizing multiple potential therapeutics in parallel and analyzing them on common platforms in a joint scientific effort spanning fourteen clinical and basic science research laboratories. During the first two years of the project, the efficacy of different therapeutic modalities will be evaluated first in cell culture and then in mouse models of NF1. In year three, we will focus exclusively on the two most promising therapeutic strategies, advancing them through more intense efficacy and safety studies in NF1 mouse models to produce datasets that will be necessary for discussions with the FDA intended to prepare for trials of the drug candidates in patients.",https://www.synapse.org/#!Synapse:syn21641985/wiki/601402,University of Massachusetts | Massachusetts General Hospital,Neurofibromatosis 1,,,,,,,"syn4939892, syn5714423, syn6633069, syn11374337, syn4939908"
214,99,Neuroprotection and optic nerve regeneration in a mouse NF1 OPG model,syn21650326,syn21669855,Active,None,Larry Benowitz,GFF,"Neurofibromatosis Type I (NF1) occurs at a frequency of 1/3000 worldwide and can cause non-cancerous tumor growth in the peripheral and central nervous systems. 15-20% of people with NF1 develop optic pathway gliomas (OPGs) in the first 7 years of life due to an excessive proliferation of astrocytes (support cells of the nervous system) and the invasion of tumors with microglia (resident immune cells in the nervous system). Retinal ganglion cells (RGCs), the nerve cells that send visual information from the eye to the brain, are vulnerable to the effects of aberrant astrocytes and microglia, and undergo cell death in many patients with OPGs, resulting in an irretrievable loss of vision. The objectives of this research are to prevent RGCs from dying in cases in which NF1-associated OPGs are diagnosed at an early stage of progression, or to enable remaining RGCs to regenerate connections back to the brain in cases in which OPGs are diagnosed at a more advanced stage and axons have atrophied. Several treatments that have proven to be successful in preserving injured RGCs and/or enabling RGCs to regenerate dam-age nerve fibers in earlier studies from our lab and others will first be tested individually for beneficial or possible negative effects in a mouse model of NF1-associated OPG. Therapies that prove to be benign or beneficial will then be combined and tested in larger groups in early and later stages of OPG progression in mice. In more basic research, we will investigate how 3 newly discovered pathways that regulate RGC survival interact with each other to develop better treatments for OPGs. Finally, we will work with the cell replacement groups to develop methods to enable endogenous or exogenous stem cell-derived RGCs to extend nerve fibers that can convey visual information to the brain. Our overall goal is to devise therapies that can be moved into clinical practice to improve vision in NF1 patients with OPGs.",https://www.synapse.org/#!Synapse:syn21650326/wiki/601459,Boston Children's Hospital,Neurofibromatosis 1,,,,,,,"syn21650366, syn21650404"
215,99,Axon regeneration and vision restoration in NF1 OPG,syn21650366,syn21669867,Active,None,Jeffrey Goldberg,GFF,"In optic glioma (OPG), including that associated with Neurofibromatosis type-1 (NF1), retinal ganglion cells (RGCs) sustain axon injury and patients lose vision, often in early life. Injury to RGC axons in the optic nerve, whether compressive, traumatic, ischemic or degenerative in nature, results in an irreversible loss of vision due to the inability of RGCs to remain viable and to regenerate their axons. Seminal studies in rodents over the past 2 decades have identified strategies that allow many RGCs to survive long-term after optic nerve injury and enable some RGCs to regenerate axons from the eye to the brain. Most of these data were developed in acute trauma models of optic nerve crush, which may or may not be directly translatable to the axon damage and optic nerve environment in NF1 OPG. In light of these promising results, we believe that the time is right for a collaborative group of investigators to join forces to achieve unprecedented levels of regeneration and to translate these findings into proof-of-concept in NF1 OPG models as well as a larger animal model, as an essential step towards eventual treatment of NF1 OPG patients.",https://www.synapse.org/#!Synapse:syn21650366/wiki/601461,Stanford University School of Medicine,Neurofibromatosis 1,,,,,,,"syn21650326, syn21650404"
216,99,Optimizing strategies to improve visual recovery from NF1 optic glioma,syn21650395,syn21669872,Active,None,David Gutmann,GFF,"Children with Neurofibromatosis type 1 (NF1) are prone to the development of benign brain tumors that affect the optic pathway (optic gliomas) and result in vision loss. While current chemotherapy is effective at halting tumor growth, few patients regain vision. For this reason, it is imperative to identify new treatments that prevent or restore vision loss from these tumors. Research over the past 15 years in the Gutmann laboratory has demonstrated that mice engineered with Nf1 gene mutations develop optic gliomas and tumor associated vision loss. In the current GVRI proposal, we plan to use a novel discovery strategy to identify a core molecular signature of vision recovery following treatment in mice, and employ these findings to evaluate promising candidates in preclinical studies in genetically engineered mice with optic gliomas and vision loss. Leveraging the GVRI team science paradigm, discoveries made using these mice will be validated in other experimental paradigms developed in the Reh, Zack, and Young laboratories. In addition, novel findings emanating from other team efforts will be evaluated in these Nf1 optic glioma mice. Taken together, we aim to identify targeted therapeutic strategies that prevent or ameliorate vision loss in children with NF1 associated optic pathway gliomas.",https://www.synapse.org/#!Synapse:syn21650395/wiki/601463,Washington University in St. Louis,Neurofibromatosis 1,,,,,,,"syn4939914, syn21650464"
