ROW_ID,ROW_VERSION,studyName,studyId,studyFileviewId,studyStatus,dataStatus,studyLeads,fundingAgency,summary,summarySource,institutions,diseaseFocus,manifestation,featured,consortium,id,accessRequirements,acknowledgementStatements,relatedStudies
147,99,Imaging Biomarkers of Neurofibromatosis,syn4939894,syn11678415,Active,None,Peter De Blank,NTAP,"The mechanism of visual acuity loss in optic pathway gliomas (OPG) involves damage to white matter connections due to tumor infiltration or compression of the visual pathway. Non-invasive methods of investigating white matter tract integrity and tissue microstructure may help measure and predict visual acuity in children with OPG. Research supported by the Francis S. Collins Scholarship examines two innovative and non-invasive measures of tissue microstructure: Diffusion Tensor Imaging (DTI) is a magnetic resonance technique to quantify white matter tracts and assess tract damage by measuring the preferential motion of water molecules along and not across hydrophobic myelin. In preliminary data, measures of white matter integrity in the optic radiations of children with OPG are associated with current visual acuity and may predict visual acuity one year later. Magnetic Resonance Fingerprinting (MRF) uses pseudo-randomized magnetic resonance acquisition parameters and a matching algorithm to rapidly quantify T1, T2, M0 and off-resonance signals. These measures of tissue microstructure have been associated with identification of tissue type and tumor grade, but have never before been available so rapidly and reliably. The goal of this project is to interrogate 2 two promising advanced magnetic resonance techniques, DTI and MRF, investigating tissue microstructure in OPG.",https://www.synapse.org/#!Synapse:syn4939894/wiki/235903,University Hospitals,Neurofibromatosis 1,Low Grade Glioma,,,syn4939894,,,"syn5698493, syn17100988"
148,99,Leveraging iPSCs to Determine Impact of NF1 Mutations,syn11374345,syn11601473,Active,Under Embargo,David Gutmann,NTAP,"Cutaneous or dermal neurofibromas (cNFs) are composed of neoplastic Schwann cells embedded in a microenvironment containing terminal nerve endings, fibroblasts, mast cells, and macrophages. While caused by loss of NF1 protein function in Schwannian lineage cells, studies in mouse plexiform neurofibroma models have revealed a critical role for non-neoplastic stromal cells (fibroblasts, mast cells, and macrophages) in tumor formation, maintenance, and continued growth. In this regard, inhibition of stromal cell (mast cells, macrophages) function in preclinical genetically-engineered mice resulted in attenuated plexiform neurofibroma growth. In addition to fibroblasts, mast cells, and macrophages, the NF1-deficient Schwann cells in cNFs often grow in proximity to terminal nerve endings. The intimate relationship between neurons and Schwann cells during normal peripheral nervous system development and function raises the intriguing possibility that neurons are important drivers of cNF growth. This notion is supported by recent studies in which the proliferation of myelinating cells in the central nervous system (oligodendrocytes) is regulated by neuronal production of a novel growth factor (neuroligin-3). Based on these provocative findings, we hypothesize that peripheral sensory neurons accelerate NF1-deficient Schwann cell growth through the elaboration of mitogens. To identify these potentially clinically-actionable mitogens, we have designed a series of milestone-driven experiments using a novel collection of patient-derived and isogenic human induced pluripotent stem cells harboring NF1-patient germline NF1 gene mutations.",https://www.synapse.org/#!Synapse:syn11374345/wiki/488824,Washington University of Saint Louis,Neurofibromatosis 1,Cutaneous Neurofibroma,,,syn11374345,The data from this study is currently under embargo. Please contact the principal investigator for access to the data.,,"syn11374341, syn4939890, syn8012599"
149,99,Microenvironmental Targets of Cutaneous Neurofibromas,syn11374341,syn11601468,Active,Under Embargo,Juha Peltonen / Sirkku Peltonen,NTAP,"Immunity has a central and complex role in tumor growth, which can be utilized when developing new treatment modalities for tumors. To date, the role of immune system in cNFs has gained little attention. Transformed cells are normally eradicated by cooperation of innate and adaptive immune cells. Immune surveillance could be expected to recognize neurofibromin neoepitopes resulting from the second hit of the NF1 gene, but this is not taking place in cNFs. Mast cells are known to be abundant in cNFs and they are increasingly more interesting as druggable targets in tumor biology and neurogenic itch. It is also not known whether mast cells of cNFs are tumorigenic or anti- tumorigenic. The goal of this project is to prove that T cells and mast cells are valid targets for the treatment of cNF. Elucidating the characteristics, roles and effects of these prominent tumor microenvironment components in promoting tumorigenesis could be used to facilitate finding of targeted therapies for the treatment of cNF. The therapeutic modalities include those already approved and those being developed for tumor biology as well as for inflammatory diseases.",https://www.synapse.org/#!Synapse:syn11374341/wiki/488819,University of Turku,Neurofibromatosis 1,Cutaneous Neurofibroma,,,syn11374341,The data from this study is currently under embargo. Please contact the principal investigator for access to the data.,,"syn11374345, syn4939890, syn8012599"
150,99,Modeling signaling networks of NF1-deficient Schwann cells and plexiform neurofibromas,syn8016599,syn15666926,Active,None,James Walker,NTAP,"We aim to identify putative proteomic and/or phosphoproteomic signatures associated with loss of NF1. Recent advances in mass-spectrometry (MS)-based proteomics permit the determination of the extent, localization, and site-specific stoichiometry of protein phosphorylation. We propose using two complementary MS-based approaches to define (i) the proteome and phosphoproteome and (ii) the activated kinome signature of NF1-deficient Schwann cells (SCs). We will perform analyses on a panel of SC lines derived from PNs. Transcriptome profiling of cell lines will complement these data sets, together providing a detailed view of the cellular signaling networks and the molecular targets controlled by neurofibromin in a cell-type relevant to the disease. Finally, we will use small molecule inhibitors to both known and any novel signaling pathways we identify to examine the adaptive kinome in treated cell lines. Combining the use of a novel panel of cell lines with the sensitivity of high-end MS, we expect to identify signaling pathways and targets previously implicated as being important in NF1-associated tumors, as well as new and unexpected targets downstream of NF1.",https://www.synapse.org/#!Synapse:syn8016599/wiki/411637,Massachusetts General Hospital,Neurofibromatosis 1,Plexiform Neurofibroma,,,syn8016599,,,"syn4939876, syn7239479, syn4939904, syn11374349"
151,99,NF Growth and Drug Resistance Pathways,syn4939892,syn8449651,Completed,Under Embargo,Nancy Ratner,NTAP,"Up to 50%> of children with NF1 develop plexiform neurofibromas that can cause severe disfigurement and serious morbidity-- and death when they compress vital organs. Most plexiform neurofibromas are resistant to chemotherapy and surgical removal is often impossible due to tumor size, location, and nerve integration. We jo not know why some human neurofibromas grow slowly and some rapidly, nor why some neurofibromas respond to therapy but others do not. Plexiform neurofibromas grow most aggressively in young children, and an appealing (unproven) idea is that transiently blocking growth of plexiform neurofibromas early in tumor development will prevent tumor progression. Models to study these critical issues have been lacking. Our laboratory has recently developed mouse models that recapitulate 1) slow and fast growing neurofibromas, and 2) neurofibromas that respond or fail to respond to targeted molecular therapy. We plan to use new methods in gene expression analysis to identify molecular pathways that correlate with these phenotypes in mouse models, with verification on human tissues. We also plan test if early treatment delays or halts neurofibroma formation by administering drugs before tumors develop in a neurofibroma mouse model.",https://www.synapse.org/#!Synapse:syn4939892/wiki/235902,Cincinnati Children's Hospital Medical Center,Neurofibromatosis 1,Plexiform Neurofibroma,,,syn4939892,,,"syn5714423, syn6633069, syn11374337, syn4939908, syn21641985"
152,99,NF1 Dermal Neurofibroma Longitudinal Natural History Study and Selumetinib Clinical Trial,syn8012530,syn11678417,Active,None,Ashley Cannon,NTAP,"Previous reports have correlated increased burden of dermal neurofibromas (DNs) with age and pregnancy, but longitudinal data are not available to establish a quantitative natural history of these tumors. Moreover, the genomic mechanisms responsible for dermal tumor proliferation are not completely understood, although biallelic inactivation of the NF1 gene is known to be required. The NF1 gene encodes neurofibromin, which negatively regulates the Ras/MAPK signaling cascade that includes the RAF/MEK/ERK and PI3K/AKT/mTOR pro-growth pathways. Current therapeutic development for NF1-related tumors target components of this pathway; however, clinical trials directed at dermal neurofibromas have been hampered by the difficulty in measuring and counting dermal neurofibromas. The overall goal of this project is to complete a longitudinal natural history study of dermal neurofibromas to enhance current knowledge of dermal neurofibroma development as well as improve the design, implementation, and interpretation of clinical trials targeting DNs. To address the clinical trial facet of this project, a trial using the MEK1/2 inhibitor selumetinib will be piloted. We will also evaluate the quality of life impact of dermal neurofibromas before and during Selumetinib treatment. For both facets of this study, we will examine genomic alterations that correlate with DN development and selumetinib response.",https://www.synapse.org/#!Synapse:syn8012530/wiki/411605,University of Alabama Medical Center,Neurofibromatosis 1,Cutaneous Neurofibroma,,,syn8012530,,,"syn5714288, syn5714290, syn8016650"
153,99,Cutaneous Neurofibroma Data Resource,syn4984604,syn11614202,Completed,Published,Salvatore La Rosa | Annette Bakker |  Justin Guinney,CTF,"In 2013, CTF began a neurofibromatosis biobank to collect NF samples to better study the disease. With all samples being collected under the same protocol, the biobank enables comprehensive analysis of diverse NF samples. To showcase the value the biobank, CTF has kicked off a pilot project designed to characterize the molecular landscape of cutaneous neurofibromas (NF) that grow in NF1 patients, sponsored by the Children's Tumor Foundation. This project includes high-throughput data from 11 different patient tumors and matched blood samples. These data are then compared with one another to assess the distinct landscape of cutaneous NF for each patient.",https://www.synapse.org/#!Synapse:syn4984604/wiki/247965,Children's Tumor Foundation | Sage Bionetworks | HudsonAlpha,Neurofibromatosis 1,Cutaneous Neurofibroma,,,syn4984604,Accessing the data from this study requires a Synapse account. You must also [request access](https://www.synapse.org/#!Synapse:syn4984604/wiki/594099) from the Children's Tumor Foundation.,"If you use data from this study in a publication or talk, please cite the following publication: ""Gosline SJ‚ Weinberg H, Knight P, et al. A high-throughput molecular data resource for cutaneous neurofibromas. Sci Data. 2017;4:170045. Published 2017 Apr 11. doi:10.1038/sdata.2017.45."" In addition, please acknowledge the NF Data Portal using the following statement: ""The results published here are in whole or in part based on data obtained from the NF Data Portal (http://www.nfdataportal.org) and made available through the NF Open Science Initiative.""",syn9727752
154,99,Synodos NF1 Preclinical Models (Iowa Sanford Exemplar),syn5610446,syn15672867,Active,Under Embargo,Jill Weimer,CTF,"The aim of Synodos for NF1 is to find solutions to the unique problems that affect NF1 patients in the fastest, most efficient manner by sharing their real-time data and results. In Project 2 of the Synodos for NF1 Consortium, researchers will develop and perfect animal models that will most accurately replicate human reaction to drugs in preclinical testing. Two teams will independently generate models; this project consists of results from the Iowa team, and includes members from the University of Iowa, University of Arizona, Exemplar Genetics and Sanford Health.",https://www.synapse.org/#!Synapse:syn5610418/wiki/392292,University of Iowa | University of Arizona | Exemplar Genetics | Sanford Health,Neurofibromatosis 1,Plexiform Neurofibroma,,,syn5610446,The data from this study is currently under embargo. Please contact the principal investigator for access to the data.,,syn5610425
155,99,Synodos NF1 Preclinical Models (Minnesota CCHMC Recombinetics),syn5610425,syn15672871,Active,Under Embargo,David Largaespada,CTF,"The aim of Synodos for NF1 is to find solutions to the unique problems that affect NF1 patients in the fastest, most efficient manner by sharing their real-time data and results. In Project 2 of the Synodos for NF1 Consortium, researchers will develop and perfect animal models that will most accurately replicate human reaction to drugs in preclinical testing. Two teams will independently generate models; this project consists of results from the Minnesota team, and includes members from the University of Minnesota, Cincinnati Children's Hospital, the National Cancer Institute, and Recombinetics Inc.",https://www.synapse.org/#!Synapse:syn5610418/wiki/392292,University of Minnesota | Cincinnati Children's Hospital Medical Center | Recombinetics | National Cancer Institute,Neurofibromatosis 1,Plexiform Neurofibroma,,,syn5610425,The data from this study is currently under embargo. Please contact the principal investigator for access to the data.,,syn5610446
156,99,"DHART SPORE Project 1: Molecular, Developmental, and Genetic Evaluation of Plexiform Neurofibromas to Inform Clinical Trials",syn5714288,syn17038349,Active,Under Embargo,Wade Clapp | Jaishri Blakeley | Brigitte Widemann | Lu Le,NIH-NCI,"The objective of Project 1 is to extend these promising data to investigate the developmental, molecular, and pharmacokinetic effects of c-kit and MEK inhibition alone and in combination. Our investigative team will characterize the adaptive responses of PNs to these kinase inhibitors in GEM models and in parallel studies in patients. The aims of Project 1 are: Aim 1: Evaluate tumor and circulating markers before and after treatment with the MEK inhibitor selumetinib in pediatric and adult patients with NF1 associated plexiform neurofibromas. Aim 2: Evaluate the molecular adaptive responses, PK/PD and clinical response of plexiform neurofibromas in genetically engineered mice (GEM) with selumetinib alone, and in combination with imatinib mesylate. Aim 3: Utilize GEM models to identify the optimal therapeutic window(s) of c-kit (SCF) inhibition at distinct embryonic and adult stages of PN formation utilizing Nf1flox/- and Nf1flox/-;Scf flox/flox mice under the transcriptional control of a PLP tamoxifen + Cre transgene. The translational impact of this project involves: (1) defining therapeutic window(s) for c-kit inhibition at distinct embryonic and adult stages of PN formation; (2) investigating a rational approach to combinatorial therapy based on simultaneously interfering with paracrine growth signals emanating from the tumor microenvironment while also targeting aberrant Raf/MEK/ERK pathway activation in tumor cells; and (3) defining novel biomarkers by analyzing tumor specimens and blood obtained both prior to and after treatment.",https://trp.cancer.gov/spores/abstracts/indiana_hyperactive.htm,"Indiana University School of Medicine | Johns Hopkins Medical Institute | National Institute of Health | University of Texas, Southwestern",Neurofibromatosis 1,Plexiform Neurofibroma,,,syn5714288,The data from this study is currently under embargo. Please contact the principal investigator for access to the data.,,"syn8012530, syn5714290, syn8016650"
157,99,DHART SPORE Project 2: Targeted Therapies for Malignant Peripheral Nerve Sheath Tumors (MPNST),syn5714289,syn17038350,Active,Under Embargo,Luis Parada | Steven X. Skapek,NIH-NCI,"Malignant peripheral nerve sheath tumors (MPNST) evolve from pre-existing plexiform neurofibromas, and we therefore hypothesize that these aggressive sarcomas continue to express some of the transcriptional programs present in the initiating fetal precursor population. This, in turn, might create novel synthetic lethal dependencies that can be exploited therapeutically. Indeed, Dr. Parada recently identified CXCR4 and CDK4/6 as key drivers of MPNST cell proliferation and tumor progression in GEM models. The major goals of Project 2 are to translate these provocative preclinical data and to harness functional imaging to develop better markers of early response in MPNST. The translational impact of these studies encompasses the development of a biomarker profile to identify early markers of MPNST progression and evaluate efficacy of CXCR4 and CDK4/6 inhibitors in clinical trials.",https://trp.cancer.gov/spores/abstracts/indiana_hyperactive.htm,"Memorial Sloan Kettering Cancer Center | University of Texas, Southwestern",Neurofibromatosis 1,MPNST,,,syn5714289,The data from this study is currently under embargo. Please contact the principal investigator for access to the data.,,"syn11681835, syn11638893, syn17098100"
158,99,DHART SPORE Project 3: A High Content Clinical Trial of the MEK Inhibitor Trametinib in Juvenile Myelomonocytic Leukemia (JMML).,syn5714290,syn17038351,Active,Under Embargo,Kevin Shannon | Mignon Loh,NIH-NCI,"Children with NF1 are predisposed to juvenile myelomonocytic leukemia (JMML), an aggressive myeloproliferative neoplasm (MPN) that responds poorly to chemotherapy. Hematopoietic stem cell transplantation (HSCT) cures ~50% of patients. Our studies of JMML specimens proved that NF1 functions as a tumor suppressor gene in hematopoietic cells, and provided the first direct evidence of deregulated Ras signaling in primary cancer cells from NF1 patients. These studies support the role of hyperactive Ras signaling in JMML pathogenesis, and our group and other researchers subsequently discovered mutations in NRAS, KRAS, PTPN11, and CBL in JMML patient specimens. Overall, >85% of JMML cases have mutations in one of these genes, including 15-20% with clinical NF1 or mutations in the NF1 gene. Despite the routine use of HSCT, up to 30% of JMML patients progress to acute myeloid leukemia (AML). Consistent with the molecular genetics of JMML, using the Mx1-Cre transgene to inactivate the conditional mutant Nf1flox allele generated by the Parada lab or to express oncogenic KrasG12D or NrasG12D in the hematopoietic compartment induces a JMML-like MPN in mice. Preclinical trials in these accurate GEM models revealed remarkable efficacy of MEK inhibitors. Importantly, however, this, treatment does not eradicate mutant bone marrow cells, but modulates their proliferation and differentiation in vivo. The overall goals of Project 3 are to translate these promising preclinical data in JMML patients though an innovative clinical trial that includes deep molecular analysis. The translational impact of these studies involves rigorously testing a novel therapeutic strategy for an aggressive pediatric cancer with deep molecular analysis of primary leukemia cells to ascertain mechanisms of response and resistance.",https://trp.cancer.gov/spores/abstracts/indiana_hyperactive.htm,"University of California, San Francisco",Neurofibromatosis 1,JMML,,,syn5714290,The data from this study is currently under embargo. Please contact the principal investigator for access to the data.,,"syn8012530, syn5714288, syn8016650"
159,99,DHART SPORE Project 4: Subsequent Malignant Neoplasms (SMNs) Among NF1 Cancer Survivors.,syn5714423,syn17038352,Active,Under Embargo,Smita Bhatia | Jean L. Nakamura,NIH-NCI,"Subsequent malignant neoplasms (SMNs) are histologically distinct cancers that develop months to years after patients receive radiation and/or chemotherapy to cure a primary malignancy. SMNs are a fundamental problem in cancer survivors. Compelling data generated by Drs. Nakamura and Shannon in GEM mice demonstrated that irradiation cooperates strongly with heterozygous Nf1 inactivation in the development of a spectrum of SMNs that recapitulate common SMNs in human patients with and without NF1. Project 4 will translate these novel data and will systematically assess the incidence of SMNs in NF1 patients and examine associated risk factors such as age at diagnosis, anatomic site of the primary tumor, and dose and duration of prior treatment. Data compiled by the NCI-funded Childhood Cancer Survivor Study (CCSS) will play an integral role in Project 4. The aims of Project 4 are: Aim 1. To describe the magnitude of risk of second malignant neoplasms (SMNs) in individuals with NF1. Aim 2. To perform comparative oncogenomics to identify genetic alterations associated with radiation-induced tumorigenesis in individuals with NF1. Aim 3. To validate in model systems the biologic importance of candidate pathways in radiation-induced tumorigenesis and to determine whether radiotherapy promotes transformation of plexiform neurofibromas to MPNSTs in vivo. The translational impact of this work involves informing current clinical practice in the treatment of tumors arising in NF1 patients to reduce the risk of SMN, and generating insights into the underlying biology of SMN that will lead to new therapies for these common, aggressive, and largely refractory cancers.",https://trp.cancer.gov/spores/abstracts/indiana_hyperactive.htm,"University of Alabama | University of California, San Francisco | Children's Hospital of Philadelphia | City of Hope",Neurofibromatosis 1,SMN,,,syn5714423,The data from this study is currently under embargo. Please contact the principal investigator for access to the data.,,"syn4939892, syn6633069, syn11374337, syn4939908, syn21641985"
160,99,Synodos NF1 Low Grade Glioma,syn5698493,syn11614205,Active,Under Embargo,David Gutmann | Michael Fisher,CTF,"Low-grade gliomas (LGGs) are brain tumors that affect children with NF1. Despite their prevalence, there are few effective treatment options for patients with LGG. The goal of the Synodos for NF1 - Low Grade Glioma projects is to improve our understanding of the molecular underpinnings of LGGs, and identify new drug targets that could lead to better treatments for this tumor type.",https://www.synapse.org/#!Synapse:syn5698493/wiki/394535,"Washington University | Children's Hospital of Philadelphia | University of California, San Francisco | German Cancer Research Center",Neurofibromatosis 1,Low Grade Glioma,,,syn5698493,The data from this study is currently under embargo. Please contact the principal investigator for access to the data.,,"syn4939894, syn17100988"
161,99,Columbia University NF1 Glioma Project,syn6633069,syn11614207,Active,Under Embargo,Antonio Iaverone,CTF,"This study aims to obtain the genomic landscape of glioma associated with NF1 syndrome. While the clinical aspects of NF1 are well characterized and the pathogenesis of plexiform neurofibromas has been widely studied, surprisingly little is known about the genetic and epigenetic changes in the NF1 mutant glioma. This has hindered the development of effective therapies for NF1-mutant cancers. To address this challenge and uncover the driver genes in NF1-glioma, The team will analyze whole-exome and transcriptome data from glioma samples of pediatric and adult NF1 patients. Alterations in the genetic networks will be contextualized in the natural genetic and cellular environment of a specific tumor, and the key driving modules on which specific NF1-glioma subgroups rely for growth, survival and progression will be identified. With this information in hand, we can target the critical alterations with specific drugs, often already available for other types of diseases. The specific aims are to (1) comprehensively characterize the genomic and epigenetic landscape of NF1 gliomas from patients of all age groups, (2) identify driver genetic alterations in NF1-gliomas from the integration of somatic copy number variations, mutations and gene fusions (translocations), (3) reconstruct a somatic alteration network for the inference of mutual exclusivity and co-occurrence of genetic aberrations in NF1-gliomas and (4) validate the functional significance of the inferred alterations in neural systems in vitro and in vivo, and target therapeutically key genetic nodes with highly specific inhibitors.",https://www.synapse.org/#!Synapse:syn6135075/wiki/470497,Columbia University | University of Sannio,Neurofibromatosis 1,Low Grade Glioma,,,syn6633069,The data from this study is currently under embargo. Please contact the principal investigator for access to the data.,,"syn4939892, syn5714423, syn11374337, syn4939908, syn21641985"
