ROW_ID,ROW_VERSION,studyName,studyId,studyFileviewId,studyStatus,dataStatus,studyLeads,fundingAgency,summary,summarySource,institutions,diseaseFocus,manifestation,featured,consortium,id,accessRequirements,acknowledgementStatements,relatedStudies
162,99,Novel pNF Farming System,syn7217946,syn15666932,Completed,None,Karlyne Reilly,NTAP,"Plexiform neurofibromas (PNFs) are relatively slow growing benign tumors that are difficult to maintain in culture over long passages. As benign tumors, PNFs are likely to be more dependent on factors in the microenvironment, such as the extracellular matrix (ECM) and paracrine growth factors, compared to malignant tumors. It is now clear that many cell types grow better in three-dimensional cultures than on two-dimensional growth surfaces, and it may be that PNFs will growth more robustly in a system that mimics their in vivo growth patterns. The goal of this project is to determine the optimum ECM substrate for nf1 null Schwann cell growth, and to develop a pNF culture system to be used in 96-well based assays (preclinical screening applications). The main goal is to improve the culture conditions for PNF cells, so that these benign tumors can be more reliably cultured from primary tumors. Our secondary goal is to develop culture conditions that lead to PNF gene expression that most closely mimics PNF cells in primary tumors. By developing faithful culture conditions, PNF cells can be tested in drug screen assays with more accurate cell responses to compounds being tested.",https://www.synapse.org/#!Synapse:syn7217946/wiki/405450,National Institutes of Health,Neurofibromatosis 1,Plexiform Neurofibroma,,,syn7217946,,,syn8016577
163,99,Novel Therapeutics in Malignant Peripheral Nerve Sheath Tumor (MPNST),syn11681835,syn15667121,Active,None,Ping Chi,NTAP,"Malignant Peripheral Nerve Sheath Tumor (MPNST) arising from the cellular component of the peripheral nerves represents a group of highly aggressive soft tissue sarcomas with limited treatment options. They can occur in the setting of type I neurofibromatosis (NF1-associated), or sporadically or in association with prior radiotherapy (RT-associated). Using comprehensive genomic approaches, we and others have discovered that the majority of MPNSTs have inactivation of three tumor suppressor pathways, including the NF1, the CDKN2A (INK4A/ARF) and the Polycomb repressive complex 2 (PRC2) pathways. Here, we propose to use multidisciplinary approaches to establish authentic MPNST model systems for preclinical investigation. We will also evaluate a combination treatment strategy of trametinib (a MEK inhibitor) and ribociclib (a CDK4/6 inhibitor) in various cell line and animal models of MPNST. Lastly, we will conduct a screen using RNA interference technology to identify and characterize the genes that are important for MPNST growth and survival when the PRC2 pathway is inactivated. These studies will build important resources for the NF1-research community and can identify novel treatment strategies and streamline clinical therapeutic development for patients with NF1-associated MPNSTs.",https://www.synapse.org/#!Synapse:syn11681835,Memorial Sloan Kettering Cancer Center,Neurofibromatosis 1,MPNST,,,syn11681835,,,"syn5714289, syn11638893, syn17098100"
164,99,Novel Treatment Approach to Neurofibromatosis Type 1-related MPNST,syn4939884,syn11678414,Active,None,Verena Staedtke,NTAP,"Due to the invasive nature and high incidence of metastases of malignant peripheral nerve sheath tumors (MPNSTs), surgery is the only treatment modality proven to have survival benefit and even when maximal surgery is feasible, these tumors are almost never curable. MPNSTs develop tumor hypoxia and necrosis as a pathophysiologic consequence of structurally and functionally disturbed microcirculation. Although tumor hypoxia is strongly associated with tumor propagation and treatment resistance, it also offers the perfect niche for the growth of the ""therapeutic"" anaerobic spore-forming bacterium Clostridium novyi-NT (C. novyi-NT). C. novyi-NT's oncolytic potential has been successfully used to treat a variety of solid cancers. Once injected, C. novyi-NT spores germinate in tumor hypoxia while vegetative bacteria cannot survive in normoxia and sporulate. We recently demonstrated robust and reproducible antitumor responses when C. novyi-NT spores were injected into dogs with spontaneous peripheral nerve sheath tumors and in human patients with therapy resistant sarcomas (NCT01924689). The goal of this project is to explore C. novyi-NT as a novel therapeutic for NF1-associated MPNSTs (gather preclinical evidence substantiating clinical trial for for C. novyi-NT therapy in NF1 patients with MPNSTs)",https://www.synapse.org/#!Synapse:syn4939884/wiki/235898,Johns Hopkins Medical Institute,Neurofibromatosis 1,Plexiform Neurofibroma,,,syn4939884,,,"syn4939902, syn7217935"
165,99,Exploring the Plexiform Neurofibroma Interactome,syn4939890,syn8449668,Completed,Published,Jianqiang Wu | Kakajan Komurov,NTAP,"NF1 mutations in Schwann cells (SCs) drive neurofibroma formation; thus the primary neoplastic cell type in neurofibromas is derived from the SC lineage. The SC genes that are deregulated in mouse and human neurofibromas have not been fully identified. Many cell types are present in neurofibromas besides SCs. These include fibroblasts, mast cells, macrophages, and endothelial cells that are NF1 wild type (as in solitary neurofibroma or in somatic mosaic patients) or NF1 heterozygous (as in many NF1 patients and some mouse models). But how these cells and the intercellular communications contribute to plexiform neurofibroma growth is unknown. It has been recently identified that macrophage is a major cell type in neurofibromas. Macrophages shift gene expression and function in response to the environment, including after nerve injury. Macrophages show anti- tumor effects by secreting free-radicals and recruiting the adaptive immune system (primarily T-cells). However as tumors progress, macrophages stimulate tumor growth and blood vessel formation. Injury-associated inflammation facilitates neurofibroma development by recruiting macrophages in mouse models. How these inter- and intra-cellular interactions contribute to neurofibroma formation has not been studied yet. The goals of this project are to characterize gene expression profiles of Schwann cells and macrophages in mouse nerves and neurofibromas, identify cytokine/chemokine pathways that slow or promote tumor growth and identify molecular networks that mediate intra- and inter-cellular signaling in controlling neurofibroma growth.",https://www.synapse.org/#!Synapse:syn4939890/wiki/235901,Cincinnati Children's Hospital Medical Center,Neurofibromatosis 1,Plexiform Neurofibroma,,,syn4939890,Accessing the data from this study requires a Synapse account.,"If you use data from this study in a publication or talk, please cite the following publication: ""Choi K, Komurov K, Fletcher JS, Jousma E, Cancelas JA, Wu J, Ratner N. An inflammatory gene signature distinguishes neurofibroma Schwann cells and macrophages from cells in the normal peripheral nervous system. Scientific Reports 2017 Mar; 7, 43315. DOI:10.1038/srep43315."" In addition, please acknowledge the NF Data Portal using the following statement: ""The results published here are in whole or in part based on data obtained from the NF Data Portal (http://www.nfdataportal.org) and made available through the NF Open Science Initiative.""","syn11374345, syn11374341, syn8012599"
166,99,Plexiform Neurofibroma Model Systems for Preclinical Drug Screening,syn7217928,syn11581628,Completed,Published,Raymond Mattingly,NTAP,"The high vascularity of plexiform neurofibromas (PNs) can cause major problems during surgery. Most in vitro drug testing is still performed on cells growing in two dimensions (2D) on plastic dishes. In comparison to 2D cultures, cells growing in a 3-dimensional (3D) matrix that models the (patho) physiological environment typically: 1) adopt a morphology that better recapitulates that in vivo; 2) exhibit slower growth more akin to those in vivo; and 3) demonstrate drug sensitivity and resistance that may better reflect potential therapeutic response. Our goals were to develop and optimize robust 3D co-culture models of NF1 PNs to allow preclinical drug screening that is both much more representative of likely translational effectiveness than provided by testing in 2D mono-culture, and at a much higher throughput than is available in animal models. Further, we predict that programs such as the NF Clinical Trials Consortium are more likely to be successful if they build on data from robust and representative pre-clinical models. Our aims were therefore to: 1. Develop, characterize and optimize 3D co-culture models to include the cell types found in NF1 PNs; and 2. Test potential drugs in the 3D models of NF1 PNs, with a focus on candidates chosen for translational potential.",https://www.synapse.org/#!Synapse:syn7217928/wiki/405448,Wayne State University,Neurofibromatosis 1,Plexiform Neurofibroma,,,syn7217928,Accessing the data from this study requires a Synapse account.,,syn4939916
167,99,Evotec Drug Target Research,syn7239560,syn11614208,Completed,Published,Tim James,CTF,A drug-target database was built by Evotec using publicly available data in order to define targets of the Minnesota Synodos NF1 screening molecules. A similar resource can be found in the Drug-Target Explorer project conducted by Sage Bionetworks.,Robert Allaway,Evotec,Multiple,,,,syn7239560,Accessing the data from this study requires a Synapse account.,,syn11672851
168,99,pNF Cell Culture for High-Throughput Screens,syn7217935,syn15666931,Completed,None,Luis Parada,NTAP,"A cardinal feature of NF1 is the development of dermal (DN) and plexiform neurofibromas (PN), benign tumors that form in the dermis or along a nerve plexus, respectively. While these tumors are histologically similar - both are complex tumors containing a number of cell types including proliferating Schwann lineage cells (from which the tumors arise), fibroblasts, and infiltrating mast cells - they arise in different locations of the body and at different developmental time points. Although initially benign, PN can undergo malignant transformation and develop into MPNSTs. The only treatment for PN is surgery, however complete resection is often difficult due to nerve involvement. The goal of this project is to generate a physiologically relevant PN cellular model system for use in preclinical drug screening.",https://www.synapse.org/#!Synapse:syn7217935/wiki/405449,Memorial Sloan Kettering Cancer Center,Neurofibromatosis 1,Plexiform Neurofibroma,,,syn7217935,,,"syn4939902, syn4939884"
169,99,pNF Cell Line Characterization Studies,syn4939874,syn7817226,Completed,Published,Jaishri Blakeley | Marc Ferrer,NTAP,"A lack of cellular model systems was recently identified as a major gap in pNF research that was slowing therapeutic discovery by relying on costly, time-consuming animal systems to identify agents that might be effective against these tumors. When NTAP was initiated, there were 2 cell culture systems for pNF from a single lab that had not been fully characterized and were not deemed suitable for drug discovery. As a direct result of NTAP's efforts, there are now 6 cell culture systems available that are actively used in the pipeline of drug discovery. These cultures are intended to model the importance of the micro-environment in pNF and the heterogeneity of these tumors. The goal of this project is the genetic characterization of NF1-/-, NF1-/+, and NF1+/+ cell-lines to be available as a tool-set for the community.",https://www.synapse.org/#!Synapse:syn4939874/wiki/235893,National Center for Advancing Translational Sciences | Sage Bionetworks | Johns Hopkins Medical Institute,Neurofibromatosis 1,Plexiform Neurofibroma,,,syn4939874,Accessing the data from this study requires a Synapse account.,"If you use data from this study in a publication or talk, please cite the following publication: ""Ferrer M, Gosline SJC, Stathis M, et al. Pharmacological and genomic profiling of neurofibromatosis type 1 plexiform neurofibroma-derived schwann cells. Sci Data. 2018;5:180106. Published 2018 Jun 12. doi:10.1038/sdata.2018.106."" In addition, please acknowledge the NF Data Portal using the following statement: ""The results published here are in whole or in part based on data obtained from the NF Data Portal (http://www.nfdataportal.org) and made available through the NF Open Science Initiative.""",syn4939906
170,99,pNF Cell Line Development,syn7239479,syn15666933,Completed,None,Peggy Wallace,NTAP,"There is a need for effective therapies for neurofibromas, particularly the larger, plexiform neurofibromas. Tissue culture is an important tool for research. However, it is difficult to derive enriched human Schwann cell cultures, and most enter replicative senescence after 6-10 passages, impeding cell-based research in NF1. We are well-positioned to develop cellular models, and collaborate with a robotics R&D/Lead Optimization group. THe goals of this project is to identify (create/characterize) semi-immortalized pNF and normal/heterozygous SC lines with suitable phenotypes, such that these lines can be tested in and transitioned to an HTS environment.",https://www.synapse.org/#!Synapse:syn7239479/wiki/405899,University of Florida,Neurofibromatosis 1,Plexiform Neurofibroma,,,syn7239479,,"If you use data from this study in a publication or talk, please cite the following publication: ""Li H, Chang LJ, Neubauer DR, Muir DF, Wallace MR. Immortalization of human normal and NF1 neurofibroma Schwann cells. Lab Invest. 2016;96(10):1105-1115. doi:10.1038/labinvest.2016.88."" In addition, please acknowledge the NF Data Portal using the following statement: ""The results published here are in whole or in part based on data obtained from the NF Data Portal (http://www.nfdataportal.org) and made available through the NF Open Science Initiative","syn4939876, syn8016599, syn4939904, syn11374349"
171,99,pNF Cell Of Origin using iPS Cells,syn4939918,syn15666930,Active,Under Embargo,Eduard Serra,NTAP,"In order to identify effective drugs against plexiform neurofibroma (PNF) formation/ progression we need to test them in the right in vitro and in vivo model systems. This involves, among other things, being able to use large quantities of NF1(+/-) and (-/-) cells closely resembling cells driving PNF formation and growth. PNF-derived NF1(+/-) and (-/-) iPS cells have been generated and can be used to test differentiation protocols towards the Neural Crest (NC) -Schwann cell (SC) lineage. Differentiated cells at different points of this lineage commitment can be characterized and engrafted into the sciatic nerve of nude mice to test their tumor-formation capacity and, in this way, interrogate about the identity of the cells originating PNFs. Two things, the setting up the right in vitro iPSC differentiation conditions towards NC and SC in one side and on the other, the characterization of the different steps of differentiation in the NC-SC lineage, will proportionate the basis for performing future drug screenings for PNFs using iPSC-derived cells. The goals of this project are to (1) set up in vitro conditions to efficiently differentiate iPS cells into cells of the Neural Crest -Schwann cell lineage. Characterize the methylome and transcriptome of these cells with distinct NF1 genotypes and test their potential engraftment/tumor formation capacity. (2) Generate new iPSC and edit control iPSC with distinct NF1 genotypes to interrogate the presence of epigenetic memory in the PNF-derived iPS cells generated",https://www.synapse.org/#!Synapse:syn4939918/wiki/235915,IGTP,Neurofibromatosis 1,Plexiform Neurofibroma,,,syn4939918,The data from this study is currently under embargo. Please contact the principal investigator for access to the data.,,syn7231973
172,99,pNF iPSCs,syn7231973,syn8662666,Completed,Published,Eduard Serra,NTAP,"Plexiform neurofibromas (pNFs) differ from discrete neurofibromas (dNFs) in their moment of appearance (though to be congenital in pNFs), the importance of the extension of the nerve and tissues affected (larger in pNFs) and their potential to progress to malignancy, not present in dNFs. Regarding genomics and transcriptomics, Schwann cells (SC) derived from dNFs and pNFs are very much alike. So what is different among these tumors that confer pNFs a risk to become malignant? The extent of affected tissue? The location? The temporal window at which a neural crest-derived cell committed to the SC lineage acquires a double inactivation of the NF1 gene? A particular cellular composition? A combination of factors? The goals of this project are to (1) Explore the degree of genomic, molecular and cellular variation within a whole plexiform neurofibroma (pNF) and (2) Obtain, authenticate and characterize NF1-/- and NF1+/- induced pluripotent stem cells (iPSC) derived from pNFs.",https://www.synapse.org/#!Synapse:syn7231973/wiki/405895,IGTP,Neurofibromatosis 1,Plexiform Neurofibroma,,,syn7231973,Accessing the data from this study requires a Synapse account. You must also [request access](https://www.synapse.org/#!Synapse:syn4939902/wiki/593715) from the study investigators.,"If you use data from this study in a publication or talk, please cite the following publication: ""Carrió M, Mazuelas H, Richaud-Patin Y, et al. Reprogramming Captures the Genetic and Tumorigenic Properties of Neurofibromatosis Type 1 Plexiform Neurofibromas [published correction appears in Stem Cell Reports. 2019 Mar 5;12(3):639-641]. Stem Cell Reports. 2019;12(2):411–426. doi: 10.1016/j.stemcr.2019.01.001"" In addition, please acknowledge the NF Data Portal using the following statement: ""The results published here are in whole or in part based on data obtained from the NF Data Portal (http://www.nfdataportal.org) and made available through the NF Open Science Initiative",syn4939918
173,99,Preclinical NF1-MPNST Platform Development,syn11638893,syn11678418,Active,Under Embargo,Angela Hirbe,NTAP,"One of the most common malignancies affecting adults with neurofibromatosis type 1 (NF1) are malignant peripheral nerve sheath tumors (MPNSTs), highly aggressive sarcomas that typically develop from benign plexiform neurofibromas. 8-13% of individuals with NF1 will develop MPNSTs during young adulthood. There are few therapeutic options, and the vast majority of people with these cancers will die within 5 years of diagnosis. Despite advances in our understanding of the pathobiology of these tumors and the identification of seemingly-promising therapeutic targets using a single mouse MPNST model system (NPCis mice and derivative cell lines), no investigational agents have demonstrated efficacy following translation to human clinical trials. However, there is limited genetic diversity being modeled in these systems, which does not capture the full spectrum of genetic diversity that characterizes human NF1-MPNSTs. In this regard, p53 loss, a common feature of the currently-used preclinical models, is observed in a minority of human MPNSTs. We hypothesize that one of the major reasons that rationally-chosen drugs underperform in human clinical trials is that the preclinical models used to discover and evaluate promising therapeutic agents do not capture the genetic heterogeneity of the human cancer. To optimize clinical translation, we aim to develop a collection of MPNST Patient Derived Xenografts (MPNST-PDXs) for the NF community, which more fully represent the spectrum of genetic heterogeneity seen in the human condition. The main goal of this research project is to develop a set of NF1-MPNST PDX lines that captures the spectrum of molecular heterogeneity of the human disease. The proposal aims to meet the following objectives: a. Create enabling resources including 10 NF1-MPNST PDX lines for preclinical studies. b. Histologically and genomically characterize these 10 NF1-MPNST PDX lines, thereby defining the molecular heterogeneity of these tumors. c. Determine whether there is a correlation between molecular subtype and response to chemotherapy or targeted therapy. d. Assess potential adaptive mechanisms or tumor resistance by assessing genomic changes following treatment.",https://www.synapse.org/#!Synapse:syn11638893/wiki/504183,Washington University of Saint Louis,Neurofibromatosis 1,MPNST,,,syn11638893,The data from this study is currently under embargo. Please contact the principal investigator for access to the data.,,"syn5714289, syn11681835, syn17098100"
175,99,Synodos Schwannomatosis,syn9727752,syn11614209,Active,Under Embargo,Gelareh Zadeh | Laura Papi,CTF,"Synodos for Schwannomatosis is a two-year initiative that will bring together basic, translational, and clinical researchers towards the end goal of developing effective treatments for schwannomatosis. The project aims to perform an extensive molecular analysis of schwannomatosis tumor samples to identify new therapeutic targets, and advance the understanding and management of the disease, with a focus on pain. Experts from institutions spread across four different countries are working together to 1) develop a clinically annotated schwannomatosis biobank; 2) develop a comprehensive pain registry for schwannomatosis patients; 3) establish the genomic and epigenomic landscape of schwannomatosis to identify disease-driving alterations; and 4) correlate the molecular findings with key clinical parameters, including pain.",https://www.synapse.org/#!Synapse:syn9727752,University Health Network of Toronto | University of Florence | Columbia University | Massachusetts General Hospital | Johns Hopkins University,Schwannomatosis,Schwannoma,,,syn9727752,The data from this study is currently under embargo. Please contact the principal investigator for access to the data.,,syn4984604
176,99,Prevention and Treatment of Optic Pathway Gliomas,syn4939914,syn15666928,Active,None,Miriam Bornhorst,NTAP,"Optic pathway gliomas (OPGs) develop in 15-20% of children with NF1 and are associated with vision loss. My preliminary data, using an NF1-deficient mouse model, indicates that there are two critical steps that need to take place in order for optic pathway gliomas to form. The first step occurs early during optic nerve development, occurring before 21 days of life. The second step involves immune cell infiltration, and thus swelling of the optic nerve and loss of retinal ganglion cells (which results in vision loss). This second step occurs around 60 days of life, and continues to progress as the mouse ages. The goal of this project is to understand this process, and develop a therapeutic plan that can be used to prevent OPG formation.",https://www.synapse.org/#!Synapse:syn4939914/wiki/235913,Children's National,Neurofibromatosis 1,Low Grade Glioma,,,syn4939914,,,"syn21650395, syn21650464"
177,99,Regulation of GCPII in Neurofibromas,syn4939904,syn15666677,Completed,None,Barbara Slusher | Nancy Ratner | Anat Stemmer-Rachamimov,NTAP,"Preliminary data suggest that GCPII may be useful as diagnostic marker in clinical pathology to differentiate histologically similar but clinically distinct malignant vs. benign NF1 tumors. This is of great clinical need as there is no consistent method to differentiate neurofibromas and MPNSTs pathologically. GCPII is selectively expressed on non-myelinating Schwann cells in the PNS (Berger, Luthi-Carter et al. 1999), which is thought to be the cell of origin for neurofibroma tumor development. Recent (unpublished data) demonstrated that small molecule GCPII inhibitors could enhance Schwann cell-mediated myelination both in vitro and in vivo, possibly by inducing non-myelinating Schwann cells to differentiate into a myelinating phenotype. By extension, it was considered conceivable that GCPII inhibition could limit the non-myelinating Schwann cell proliferation that occurs in neurofibromas by inducing the Schwann cells into a differentiated phenotype. The goals of this project are to evaluate (1) the Schwann cell enzyme Glutamate Carboxypeptidase II (GCPII) as a potential diagnostic marker to distinguish between malignant and benign peripheral nerve sheath tumors in patients with neurofibromatosis type 1 (NF1), and (2) the potential therapeutic effect of inhibiting GCPII enzymatic activity on the growth of neurofibroma tumors in animal models.",https://www.synapse.org/#!Synapse:syn4939904/wiki/235908,Johns Hopkins Medical Institute | Cincinnati Children's Hospital Medical Center |,Neurofibromatosis 1,Plexiform Neurofibroma,,,syn4939904,,,"syn4939876, syn8016599, syn7239479, syn11374349"
178,99,Screening of Plexiform Neurofibroma 3D Models,syn4939916,syn8449638,Completed,Published,Raymond Mattingly,NTAP,"In our primary NTAP project we developed and optimized 3D models of NF1 plexiform neurofibromas (PNs) with the goal of providing efficient and effective systems for secondary screening of compounds that would be identified as promising new approaches for these tumors. Another primary NTAP project was performed at NCATS to screen for potential therapeutics using the CellTiter-Glo assay of proliferation as the read-out in a 1536-well 2D growth format. The goals of this project are to prove that cells grown in 3D matrices, as compared to those growing in 2D (on plastic) will exhibit drug sensitivity that is a better clinical predictor.",https://www.synapse.org/#!Synapse:syn4939916/wiki/235914,Wayne State University,Neurofibromatosis 1,Plexiform Neurofibroma,,,syn4939916,Accessing the data from this study requires a Synapse account.,,syn7217928
